{
  "schema_version": "paper2-reference-structural-adjudication-v1",
  "claim_id": "CNC01.C1",
  "adjudicator": {
    "tool": "GPT-5.6 Sol",
    "version": "2026-09-28",
    "procedure": "paper2-reference-structural-adjudication-v1-cnc",
    "adjudicated_at": "2026-09-28T14:24:00Z"
  },
  "coordinate_map": [
    {
      "claim_node_id": "grouping_coherence",
      "coordinate_id": "basis.n01",
      "required": true
    },
    {
      "claim_node_id": "background_explanatory_knowledge",
      "coordinate_id": "basis.n02",
      "required": true
    },
    {
      "claim_node_id": "internal_relational_structure",
      "coordinate_id": "basis.n03",
      "required": true
    },
    {
      "claim_node_id": "external_knowledge_fit",
      "coordinate_id": "basis.n04",
      "required": true
    },
    {
      "claim_node_id": "underconstrained_alternative_groupings",
      "coordinate_id": "basis.n05",
      "required": true
    }
  ],
  "controls": {
    "probe_P": {
      "state": "not_required"
    },
    "criterion_Q": {
      "state": "not_required"
    },
    "partition_Pi": {
      "state": "not_required"
    },
    "resource_C": {
      "state": "not_required"
    }
  },
  "temporal": {
    "time_index": {
      "state": "not_required"
    },
    "history_window": {
      "state": "not_required"
    },
    "future_horizon": {
      "state": "not_required"
    },
    "recurrence": {
      "state": "not_required"
    },
    "persistence": {
      "state": "not_required"
    },
    "ordering": []
  },
  "approximation": {
    "mode": "deterministic",
    "threshold": {
      "state": "not_required"
    },
    "tolerance": {
      "state": "not_required"
    },
    "confidence": {
      "state": "not_applicable"
    },
    "loss": {
      "state": "not_required"
    },
    "comparison_criterion": {
      "state": "not_required"
    }
  },
  "bridge_assumptions": [],
  "decision": {
    "status": "PASS"
  }
}
