{
  "schema_version": "paper2-reference-structural-adjudication-v1",
  "claim_id": "ATT01.C1",
  "adjudicator": {
    "tool": "ChatGPT",
    "version": "GPT-5.6 Sol",
    "procedure": "paper2-reference-structural-adjudication-v1:267",
    "adjudicated_at": "2026-09-28"
  },
  "coordinate_map": [
    {
      "claim_node_id": "perceptual_unit_partition",
      "coordinate_id": "basis.pi1",
      "required": true
    },
    {
      "claim_node_id": "single_unit_dual_judgment",
      "coordinate_id": "basis.cnd1",
      "required": true
    },
    {
      "claim_node_id": "cross_unit_dual_judgment",
      "coordinate_id": "basis.cnd2",
      "required": true
    },
    {
      "claim_node_id": "report_accuracy",
      "coordinate_id": "basis.o1",
      "required": true
    },
    {
      "claim_node_id": "brief_display_probe",
      "coordinate_id": "basis.p1",
      "required": true
    },
    {
      "claim_node_id": "accurate_attribute_report",
      "coordinate_id": "basis.q1",
      "required": true
    }
  ],
  "controls": {
    "probe_P": {
      "state": "present",
      "claim_node_ids": [
        "brief_display_probe"
      ],
      "provenance_kind": "source_declared",
      "fixed_before_phi": true
    },
    "criterion_Q": {
      "state": "present",
      "claim_node_ids": [
        "accurate_attribute_report"
      ],
      "provenance_kind": "source_declared",
      "fixed_before_phi": true
    },
    "partition_Pi": {
      "state": "present",
      "claim_node_ids": [
        "perceptual_unit_partition"
      ],
      "provenance_kind": "source_declared",
      "fixed_before_phi": true
    },
    "resource_C": {
      "state": "not_required"
    }
  },
  "temporal": {
    "time_index": {
      "state": "not_required"
    },
    "history_window": {
      "state": "not_required"
    },
    "future_horizon": {
      "state": "not_required"
    },
    "recurrence": {
      "state": "not_required"
    },
    "persistence": {
      "state": "not_required"
    },
    "ordering": []
  },
  "approximation": {
    "mode": "stochastic",
    "threshold": {
      "state": "not_required"
    },
    "tolerance": {
      "state": "not_required"
    },
    "confidence": {
      "state": "not_applicable"
    },
    "loss": {
      "state": "not_required"
    },
    "comparison_criterion": {
      "state": "not_required"
    }
  },
  "bridge_assumptions": [],
  "decision": {
    "status": "PASS"
  }
}
