{
  "schema_version": "paper2-reference-structural-adjudication-v1",
  "claim_id": "LRN01.C1",
  "adjudicator": {
    "tool": "ChatGPT",
    "version": "GPT-5.6 Sol",
    "procedure": "paper2-reference-structural-adjudication-v1:267",
    "adjudicated_at": "2026-09-28"
  },
  "coordinate_map": [
    {
      "claim_node_id": "amnesic_group",
      "coordinate_id": "basis.cnd1",
      "required": true
    },
    {
      "claim_node_id": "pd_group",
      "coordinate_id": "basis.cnd2",
      "required": true
    },
    {
      "claim_node_id": "frontal_lesion_group",
      "coordinate_id": "basis.cnd3",
      "required": true
    },
    {
      "claim_node_id": "probabilistic_training_sequence",
      "coordinate_id": "basis.oth1",
      "required": true
    },
    {
      "claim_node_id": "classification_acquisition",
      "coordinate_id": "basis.o1",
      "required": true
    },
    {
      "claim_node_id": "episode_questionnaire",
      "coordinate_id": "basis.p1",
      "required": true
    },
    {
      "claim_node_id": "explicit_episode_report",
      "coordinate_id": "basis.o2",
      "required": true
    },
    {
      "claim_node_id": "classification_accuracy_criterion",
      "coordinate_id": "basis.q1",
      "required": true
    },
    {
      "claim_node_id": "separate_parallel_systems",
      "coordinate_id": "basis.s1",
      "required": true
    },
    {
      "claim_node_id": "striatal_substrate",
      "coordinate_id": "basis.s2",
      "required": true
    }
  ],
  "controls": {
    "probe_P": {
      "state": "present",
      "claim_node_ids": [
        "episode_questionnaire"
      ],
      "provenance_kind": "source_declared",
      "fixed_before_phi": true
    },
    "criterion_Q": {
      "state": "present",
      "claim_node_ids": [
        "classification_accuracy_criterion"
      ],
      "provenance_kind": "source_declared",
      "fixed_before_phi": true
    },
    "partition_Pi": {
      "state": "not_required"
    },
    "resource_C": {
      "state": "not_required"
    }
  },
  "temporal": {
    "time_index": {
      "state": "present",
      "source_span_ids": [
        "s2",
        "s3",
        "s4"
      ]
    },
    "history_window": {
      "state": "not_required"
    },
    "future_horizon": {
      "state": "present",
      "source_span_ids": [
        "s2"
      ]
    },
    "recurrence": {
      "state": "present",
      "source_span_ids": [
        "s2",
        "s3",
        "s4"
      ]
    },
    "persistence": {
      "state": "not_required"
    },
    "ordering": [
      {
        "before_coordinate_id": "basis.oth1",
        "after_coordinate_id": "basis.p1",
        "source_span_ids": [
          "s2"
        ]
      }
    ]
  },
  "approximation": {
    "mode": "stochastic",
    "threshold": {
      "state": "not_required"
    },
    "tolerance": {
      "state": "not_required"
    },
    "confidence": {
      "state": "not_applicable"
    },
    "loss": {
      "state": "not_required"
    },
    "comparison_criterion": {
      "state": "not_required"
    }
  },
  "bridge_assumptions": [],
  "decision": {
    "status": "PASS"
  }
}
