{
  "schema_version": "paper2-reference-structural-adjudication-v1",
  "claim_id": "MEM02.C1",
  "adjudicator": {
    "tool": "ChatGPT",
    "version": "GPT-5.6 Sol",
    "procedure": "paper2-reference-structural-adjudication-v1:267",
    "adjudicated_at": "2026-09-28"
  },
  "coordinate_map": [
    {
      "claim_node_id": "central_limited_store",
      "coordinate_id": "basis.s1",
      "required": true
    },
    {
      "claim_node_id": "retained_unit_count",
      "coordinate_id": "basis.o1",
      "required": true
    },
    {
      "claim_node_id": "qualifying_limit_conditions",
      "coordinate_id": "basis.cnd1",
      "required": true
    },
    {
      "claim_node_id": "limit_probe_family",
      "coordinate_id": "basis.p1",
      "required": true
    }
  ],
  "controls": {
    "probe_P": {
      "state": "present",
      "claim_node_ids": [
        "limit_probe_family"
      ],
      "provenance_kind": "source_declared",
      "fixed_before_phi": true
    },
    "criterion_Q": {
      "state": "not_required"
    },
    "partition_Pi": {
      "state": "not_required"
    },
    "resource_C": {
      "state": "present",
      "claim_node_ids": [
        "central_limited_store",
        "retained_unit_count"
      ],
      "provenance_kind": "source_declared",
      "fixed_before_phi": true
    }
  },
  "temporal": {
    "time_index": {
      "state": "not_required"
    },
    "history_window": {
      "state": "not_required"
    },
    "future_horizon": {
      "state": "not_required"
    },
    "recurrence": {
      "state": "not_required"
    },
    "persistence": {
      "state": "not_required"
    },
    "ordering": []
  },
  "approximation": {
    "mode": "stochastic",
    "threshold": {
      "state": "not_required"
    },
    "tolerance": {
      "state": "not_required"
    },
    "confidence": {
      "state": "not_applicable"
    },
    "loss": {
      "state": "not_required"
    },
    "comparison_criterion": {
      "state": "not_required"
    }
  },
  "bridge_assumptions": [],
  "decision": {
    "status": "PASS"
  }
}
