{
  "schema_version": "paper2-reference-structural-adjudication-v1",
  "claim_id": "CTL06.C1",
  "adjudicator": {
    "tool": "ChatGPT",
    "version": "GPT-5.6 Sol",
    "procedure": "paper2-reference-structural-adjudication-v1:267",
    "adjudicated_at": "2026-09-28"
  },
  "coordinate_map": [
    {
      "claim_node_id": "prior_rule_state",
      "coordinate_id": "basis.s1",
      "required": true
    },
    {
      "claim_node_id": "current_rule_state",
      "coordinate_id": "basis.s2",
      "required": true
    },
    {
      "claim_node_id": "rule_transition",
      "coordinate_id": "basis.p1",
      "required": true
    },
    {
      "claim_node_id": "preparation_interval",
      "coordinate_id": "basis.cnd1",
      "required": true
    },
    {
      "claim_node_id": "response_latency_error",
      "coordinate_id": "basis.o1",
      "required": true
    },
    {
      "claim_node_id": "transition_penalty",
      "coordinate_id": "basis.q1",
      "required": true
    },
    {
      "claim_node_id": "rule_transition_probe",
      "coordinate_id": "basis.p2",
      "required": true
    }
  ],
  "controls": {
    "probe_P": {
      "state": "present",
      "claim_node_ids": [
        "rule_transition",
        "rule_transition_probe"
      ],
      "provenance_kind": "source_declared",
      "fixed_before_phi": true
    },
    "criterion_Q": {
      "state": "present",
      "claim_node_ids": [
        "transition_penalty"
      ],
      "provenance_kind": "source_declared",
      "fixed_before_phi": true
    },
    "partition_Pi": {
      "state": "not_required"
    },
    "resource_C": {
      "state": "not_required"
    }
  },
  "temporal": {
    "time_index": {
      "state": "present",
      "source_span_ids": [
        "s1",
        "s2",
        "s3"
      ]
    },
    "history_window": {
      "state": "present",
      "source_span_ids": [
        "s1",
        "s3"
      ]
    },
    "future_horizon": {
      "state": "present",
      "source_span_ids": [
        "s2",
        "s3"
      ]
    },
    "recurrence": {
      "state": "present",
      "source_span_ids": [
        "s1",
        "s2",
        "s3"
      ]
    },
    "persistence": {
      "state": "not_required"
    },
    "ordering": [
      {
        "before_coordinate_id": "basis.s1",
        "after_coordinate_id": "basis.s2",
        "source_span_ids": [
          "s1",
          "s3"
        ]
      }
    ]
  },
  "approximation": {
    "mode": "stochastic",
    "threshold": {
      "state": "not_required"
    },
    "tolerance": {
      "state": "not_required"
    },
    "confidence": {
      "state": "not_applicable"
    },
    "loss": {
      "state": "not_required"
    },
    "comparison_criterion": {
      "state": "not_required"
    }
  },
  "bridge_assumptions": [],
  "decision": {
    "status": "PASS"
  }
}
