{
  "schema_version": "paper2-reference-structural-adjudication-v1",
  "claim_id": "CNC03.C1",
  "adjudicator": {
    "tool": "ChatGPT",
    "version": "GPT-5.6 Sol",
    "procedure": "paper2-reference-structural-adjudication-v1:267",
    "adjudicated_at": "2026-09-28"
  },
  "coordinate_map": [
    {
      "claim_node_id": "source_domain",
      "coordinate_id": "basis.s1",
      "required": true
    },
    {
      "claim_node_id": "target_domain",
      "coordinate_id": "basis.s2",
      "required": true
    },
    {
      "claim_node_id": "object_correspondence",
      "coordinate_id": "basis.pi1",
      "required": true
    },
    {
      "claim_node_id": "object_attributes",
      "coordinate_id": "basis.s3",
      "required": true
    },
    {
      "claim_node_id": "relational_predicates",
      "coordinate_id": "basis.s4",
      "required": true
    },
    {
      "claim_node_id": "higher_order_relational_system",
      "coordinate_id": "basis.s5",
      "required": true
    }
  ],
  "controls": {
    "probe_P": {
      "state": "not_required"
    },
    "criterion_Q": {
      "state": "not_required"
    },
    "partition_Pi": {
      "state": "present",
      "claim_node_ids": [
        "object_correspondence"
      ],
      "provenance_kind": "source_declared",
      "fixed_before_phi": true
    },
    "resource_C": {
      "state": "not_required"
    }
  },
  "temporal": {
    "time_index": {
      "state": "not_required"
    },
    "history_window": {
      "state": "not_required"
    },
    "future_horizon": {
      "state": "not_required"
    },
    "recurrence": {
      "state": "not_required"
    },
    "persistence": {
      "state": "not_required"
    },
    "ordering": []
  },
  "approximation": {
    "mode": "deterministic",
    "threshold": {
      "state": "not_required"
    },
    "tolerance": {
      "state": "not_required"
    },
    "confidence": {
      "state": "not_applicable"
    },
    "loss": {
      "state": "not_required"
    },
    "comparison_criterion": {
      "state": "not_required"
    }
  },
  "bridge_assumptions": [],
  "decision": {
    "status": "PASS"
  }
}
